,agency,location_id,name,latitude,longitude,lat_long_type,county,hydrologic_unit,drainage_area,datum_of_gage,datum_type
205,USGS,09504500,"OAK CREEK NEAR CORNVILLE, AZ","34°45'52""","111°53'25""",NAD27,Yavapai,15060202,355,3470,NGVD29
206,USGS,09504950,"VERDE RIVER ABOVE CAMP VERDE, AZ","34°36'42.11""","111°53'54.35""",NAD83,Yavapai,15060202,,3122,NAVD88
207,USGS,09505200,"WET BEAVER CREEK NEAR RIMROCK, AZ","34°40'29""","111°40'17""",NAD27,Yavapai,15060202,111,4020,NGVD29
208,USGS,09505220,"ROCKY GULCH NR RIMROCK, AZ","34°44'49""","111°29'38""",NAD27,Coconino,15060202,1.40,6750,NGVD29
209,USGS,09505350,"DRY BEAVER CREEK NEAR RIMROCK, AZ","34°43'43""","111°46'30""",NAD27,Yavapai,15060202,142,3694.38,NGVD29
210,USGS,09505800,"WEST CLEAR CREEK NEAR CAMP VERDE, AZ","34°32'19""","111°41'36""",NAD27,Yavapai,15060203,241,3630,NGVD29
211,USGS,09506000,"VERDE RIVER NEAR CAMP VERDE, AZ","34°26'54""","111°47'21""",NAD27,Yavapai,15060203,5009,2874.10,NGVD29
212,USGS,09507480,"FOSSIL CREEK NEAR STRAWBERRY, AZ","34°23'39.5""","111°37'48""",NAD83,Gila,15060203,68.5,3600,NGVD29
213,USGS,09507500,"FOSSIL CR DIV TO CHILDS POWERPLANT, NR CAMP VERDE","34°22'06""","111°39'56""",NAD27,Yavapai,15060203,,3716.2,NGVD29
214,USGS,09507580,"EAST VERDE R DIV FROM EAST CLEAR CR NR PINE, AZ","34°25'04""","111°15'47""",NAD27,Gila,15060203,,5774,NGVD29
215,USGS,09507980,"EAST VERDE RIVER NEAR CHILDS, AZ","34°16'35""","111°38'17""",NAD27,Gila,15060203,331,2500,NGVD29
216,USGS,09508000,"VERDE RIVER BELOW EAST VERDE RIVER NEAR CHILDS, AZ","34°15'48.81""","111°40'53.50""",NAD83,Yavapai,15060203,5606.00,2450,NGVD29
217,USGS,09508300,"WET BOTTOM CREEK NEAR CHILDS, AZ","34°09'39""","111°41'32""",NAD27,Gila,15060203,36.4,2320,NGVD29
218,USGS,09508500,"VERDE RVR BLW TANGLE CREEK, ABV HORSESHOE DAM, AZ","34°04'23""","111°42'56""",NAD27,Yavapai,15060203,5858,2029,NGVD29
219,USGS,09509501,"HORSESHOE RESERVOIR AT HORSESHOE DAM, AZ","33°59'05""","111°42'35""",NAD27,Maricopa,15060203,5973,1900.0,NGVD29
220,USGS,09509502,"BARTLETT RESERVOIR AT BARTLETT DAM, AZ","33°49'05""","111°37'52""",NAD27,Maricopa,15060203,6157,1599.46,NGVD29
221,USGS,09510000,"VERDE RIVER BELOW BARTLETT DAM, AZ","33°48'30""","111°39'46""",NAD27,Maricopa,15060203,6161,1570.34,NGVD29
222,USGS,09510200,"SYCAMORE CREEK NEAR FORT MCDOWELL, AZ","33°41'39""","111°32'28""",NAD27,Maricopa,15060203,164,1759.33,NGVD29
223,USGS,09511300,"VERDE RIVER NEAR SCOTTSDALE, AZ","33°33'31""","111°40'07""",NAD27,Maricopa,15060203,6615.00,1320.31,NGVD29
224,USGS,09512060,"SALT RIVER AT ALMA SCHOOL RD NR MESA,AZ","33°27'11""","111°51'25""",NAD27,Maricopa,15060106,,1200,NGVD29
225,USGS,09512162,"INDIAN BEND WASH AT CURRY ROAD, TEMPE, AZ.","33°26'25""","111°54'52""",NAD27,Maricopa,15060106,82,1162.45,NGVD29
226,USGS,09512165,"SALT RIVER AT PRIEST DRIVE NEAR PHOENIX, AZ.","33°26'22""","111°57'37""",NAD27,Maricopa,15060106,13223,1135,NGVD29
227,USGS,09512190,SALT RIVER AT 24TH STREET AT PHOENIX,"33°24'56""","112°01'45""",NAD27,Maricopa,15060106,13263,1100,NGVD29
228,USGS,09512280,"CAVE CREEK BLW COTTONWOOD CR NEAR CAVE CREEK, AZ.","33°53'14""","111°57'12""",NAD27,Maricopa,15060106,82.70,2280,NGVD29
229,USGS,09512400,"CAVE CREEK AT PHOENIX, ARIZ.","33°34'56""","112°06'43""",NAD27,Maricopa,15060106,252.00,1236.37,NGVD29
230,USGS,09512406,"SALT RIVER AT 51ST AVENUE, PHOENIX, AZ","33°24'05""","112°10'05""",NAD27,Maricopa,15060106,13405,1050,NGVD29
231,USGS,09512450,"AGUA FRIA RIVER NEAR HUMBOLDT, AZ","34°29'07""","112°14'15""",NAD83,Yavapai,15070102,175,4400,NAVD88
232,USGS,09512500,"AGUA FRIA RIVER NEAR MAYER, AZ","34°18'55""","112°03'48""",NAD27,Yavapai,15070102,585,3434,NGVD29
233,USGS,09512600,TURKEY CREEK NEAR CLEATOR ARIZONA,"34°16'56""","112°12'25""",NAD27,Yavapai,15070102,89.40,3140,NGVD29
234,USGS,09512800,"AGUA FRIA RIVER NEAR ROCK SPRINGS, AZ","34°00'56""","112°10'02""",NAD27,Yavapai,15070102,1111,1800,NGVD29
235,USGS,09512830,BOULDER CREEK NR ROCK SPRINGS AZ.,"33°59'55""","112°12'57""",NAD27,Yavapai,15070102,37.80,1890,NGVD29
236,USGS,09512860,"HUMBUG CREEK, NEAR CASTLE HOT SPRINGS, AZ","33°58'02""","112°17'34""",NAD27,Yavapai,15070102,59.9,1790,NGVD29
237,USGS,09512970,"COTTONWOOD CREEK NEAR WADDELL DAM, AZ","33°53'55""","112°18'39""",NAD27,Yavapai,15070102,9.28,1660,NGVD29
238,USGS,09513650,"AGUA FRIA RIVER AT EL MIRAGE, AZ","33°36'24""","112°18'14""",NAD27,Maricopa,15070102,1628.00,,
239,USGS,09513780,"NEW RIVER NEAR ROCK SPRINGS, AZ.","33°58'27""","112°05'54""",NAD27,Maricopa,15070102,68.30,2310,NGVD29
240,USGS,09513835,"NEW RIVER AT BELL ROAD, NEAR PEORIA, ARIZ.","33°38'18""","112°14'22""",NAD27,Maricopa,15070102,185,1190,NGVD29
241,USGS,09513860,"SKUNK CREEK NEAR PHOENIX, AZ","33°43'45""","112°07'09""",NAD27,Maricopa,15070102,64.9,1472.60,NGVD29
242,USGS,09513910,"NEW RIVER NR GLENDALE, ARIZ.","33°32'12""","112°16'52""",NAD27,Maricopa,15070102,323.00,1135,NGVD29
243,USGS,09514000," BUCKEYE CANAL NEAR AVONDALE, ARIZ.","33°23'38""","112°22'24""",NAD27,Maricopa,15070101,,912.5,NGVD29
244,USGS,09514100,"GILA RIVER AT ESTRELLA PARKWAY, NEAR GOODYEAR, AZ","33°23'15""","112°23'30""",NAD27,Maricopa,15070101,45585,883,NGVD29
245,USGS,09514300,"GILA R AT STATE HWY 85, NR BUCKEYE, AZ","33°20'03""","112°37'22""",NAD27,Maricopa,15070101,46345.00,820,NGVD29
246,USGS,09516500,"HASSAYAMPA RIVER NEAR MORRISTOWN, AZ.","33°53'06""","112°39'41""",NAD27,Maricopa,15070103,796,1831.16,NGVD29
247,USGS,09517000,"HASSAYAMPA RIVER NEAR ARLINGTON, AZ","33°20'50""","112°43'30""",NAD27,Maricopa,15070103,1471,822.68,NGVD29
248,USGS,09517490,CENTENNIAL WASH AT SOUTHERN PACIFIC RAILROAD BRDG,"33°18'37""","112°52'52""",NAD27,Maricopa,15070104,1817.00,841.06,NGVD29
249,USGS,09518500,"GILA BEND CANAL AT GILLESPIE DAM, AZ","33°13'45""","112°46'00""",NAD27,Maricopa,15070101,49650,,
250,USGS,09519000,"ENTERPRISE CANAL AT GILLESPIE DAM, AZ","33°13'45""","112°46'15""",NAD27,Maricopa,15070101,49650,,
251,USGS,09519500,"GILA RIVER BELOW GILLESPIE DAM, AZ (FLOW BLW DAM)","33°13'45""","112°46'00""",NAD27,Maricopa,15070101,49650,753.46,NGVD29
252,USGS,09519501,"GILA R BLW GILLESPIE DAM, AZ (LOW-FLOW STATION)","33°13'45""","112°46'00""",NAD27,Maricopa,15070101,,,
253,USGS,09519760,"SAUCEDA WASH NEAR GILA BEND, AZ","32°52'14""","112°45'30""",NAD27,Maricopa,15070101,126,900,NGVD29
254,USGS,09519800,"GILA RIVER BELOW PAINTED ROCK DAM, AZ","33°04'30""","113°00'50""",NAD27,Maricopa,15070201,50910,518.69,NGVD29
255,USGS,09520280,"GILA RIVER NEAR DATELAND, AZ","32°52'56""","113°32'26""",NAD27,Yuma,15070201,55000,363.33,NGVD29
256,USGS,09520360,"GILA RIVER NEAR MOHAWK, AZ","32°47'18""","113°45'48""",NAD27,Yuma,15070201,55430.00,300,NGVD29
257,USGS,09520500,"GILA RIVER NEAR DOME, AZ","32°45'39""","114°25'11""",NAD27,Yuma,15070201,57850,139.18,NGVD29
258,USGS,09520900,"COLORADO RVR ABV OCEAN TO OCEAN BRIDGE NR YUMA, AZ","32°43'35.50""","114°36'06.96""",NAD83,Yuma,15030107,,117,NAVD88
259,USGS,09522400,"MITTRY LAKE DIVERSION AT IMPERIAL DAM, AZ","32°52'46""","114°27'37""",NAD27,Yuma,15030107,,,
260,USGS,09522500,"GILA GRAVITY MAIN CANAL AT IMPERIAL DAM, AZ-CA","32°52'34""","114°27'18""",NAD27,Yuma,15030107,,160,NGVD29
261,USGS,09522600,"NORTH GILA MAIN CANAL NEAR YUMA, AZ","32°48'11""","114°29'40""",NAD27,Yuma,15030107,,,
262,USGS,09522650,"NORTH GILA MAIN CANAL NO. 2 NEAR YUMA, AZ","32°45'09""","114°29'34""",NAD27,Yuma,15030107,,,
263,USGS,09522660,"GILA MONSTER FARMS TURNOUT NO. 1 NEAR YUMA, AZ","32°44'42""","114°28'44""",NAD83,Yuma,15070201,,165,NGVD29
264,USGS,09522680,"GILA MONSTER FARMS TURNOUT NO. 2 NEAR YUMA, AZ","32°44'38""","114°27'42""",NAD83,Yuma,15070201,,169,NAVD88
265,USGS,09522700,"WELLTON-MOHAWK MAIN CANAL NEAR YUMA, AZ","32°44'32""","114°25'59""",NAD27,Yuma,15070201,,,
266,USGS,09522710,YUMA IRRIGATION DISTRICT 15.4 LATERAL,"32°44'18""","114°26'18""",NAD27,Yuma,15070201,,175,NGVD29
267,USGS,09522720,YUMA IRRIGATION DISTRICT 16.4 N. LATERAL,"32°43'16""","114°25'35.6""",NAD27,Yuma,15070201,,167,NGVD29
268,USGS,09522730,YUMA IRRIGATION DISTRICT 16.4 S. LATERAL,"32°43'14.4""","114°25'35.3""",NAD27,Yuma,15070201,,169,NGVD29
269,USGS,09522740,YUMA IRRIGATION DISTRICT 17.4 LATERAL,"32°42'59.7""","114°26'16.2""",NAD27,Yuma,15070201,,164,NGVD29
270,USGS,09522750,YUMA IRRIGATION DISTRICT 18.2 LATERAL,"32°42'25.6""","114°26'48.6""",NAD27,Yuma,15070201,,164,NGVD29
271,USGS,09522760,YUMA IRRIGATION DISTRICT 18.4 LATERAL,"32°42'12""","114°26'49""",NAD27,Yuma,15070201,,164,NGVD29
272,USGS,09522770,YUMA IRRIGATION DIST 18.7 LATERAL,"32°41'58""","114°26'53""",NAD27,Yuma,15070201,,164,NAVD88
273,USGS,09522800,"SOUTH GILA MAIN CANAL NEAR YUMA, AZ","32°41'25""","114°28'31""",NAD27,Yuma,15070201,,165,NGVD29
274,USGS,09522850,"GILA GRAVITY CANAL AT YUMA-MESA PUMPING PLANT, AZ","32°40'59""","114°28'12""",NAD83,Yuma,15070201,,211,NGVD29
275,USGS,09522860,CITY OF YUMA DIVERSION AT AVENUE 9E PUMPING PLANT,"32°40'44""","114°28'43""",NAD83,Yuma,15070201,,215,NAVD88
276,USGS,09522880,"MCAS DIVERSION OF B CANAL NEAR YUMA, AZ","32°38'56""","114°34'56""",NAD83,Yuma,15030107,,208,NGVD29
277,USGS,09522900,"UNIT B CANAL NEAR YUMA, AZ","32°37'04""","114°37'16""",NAD27,Yuma,15030108,,,
278,USGS,09525500,"YUMA MAIN CANAL BLW COLORADO R. SIPHON AT YUMA, AZ","32°43'49""","114°37'09""",NAD27,Yuma,15030107,,100.6,NGVD29
279,USGS,09526000,DIVERSION FROM YUMA MAIN CANAL FOR YUMA MUNICIPAL,"32°43'35""","114°37'02""",NAD83,Yuma,15030107,,134,NGVD29
280,USGS,09527900,"MITTRY LAKE OUTLET CHANNEL NR YUMA, AZ","32°49'08.9""","114°29'05.3""",NAD27,Yuma,15030107,,,
281,USGS,09528200,COCOPAH DIVERSION FROM WEST MAIN CANAL NR SOMERTON,"32°37'06""","114°45'42""",NAD83,Yuma,15030107,,120,NAVD88
282,USGS,09528800,"LEVEE CANAL WASTEWAY NEAR YUMA, AZ","32°45'31""","114°31'26""",NAD27,Yuma,15030107,,140,NGVD29
283,USGS,09529000,"GILA DRAIN NO. 1 NEAR YUMA, AZ","32°45'32""","114°31'18""",NAD27,Yuma,15030107,,135,NGVD29
284,USGS,09529150,"NORTH GILA MAIN CANAL WASTEWAY NEAR YUMA, AZ","32°43'37""","114°30'17""",NAD27,Yuma,15070201,,140,NGVD29
285,USGS,09529250,"BRUCE CHURCH WASTEWAY NEAR YUMA, AZ","32°42'55""","114°31'58""",NAD27,Yuma,15070201,,138,NGVD29
286,USGS,09529300,"WELLTON-MOHAWK MAIN OUTLET DRAIN NR YUMA, AZ","32°44'33""","114°26'10""",NAD27,Yuma,15070201,,160,NGVD29
287,USGS,09529420,"SOUTH GILA TERMINAL CANAL WASTEWAY NR YUMA, AZ","32°41'37""","114°34'50""",NAD27,Yuma,15030107,,150,NGVD29
288,USGS,09530100,CITY OF YUMA INFLOW TO SEWAGE TREATMENT PLANT,"32°43'46""","114°39'55""",NAD83,Yuma,15030107,,124,NGVD29
289,USGS,09535295,"VAMORI WASH AT INTL BOUNDARY NEAR SELLS, AZ.","31°33'36""","111°46'58""",NAD27,Pima,15080102,246.4854,,
290,USGS,09535900,"QUITOBAQUITO SPRING NEAR LUKEVILLE, AZ","31°56'37""","113°01'10""",NAD27,Pima,15080102,,,
291,USGS,09535902,"QUITOBAQUITO POND NEAR LUKEVILLE, AZ","31°56'32.58""","113°01'14.19""",NAD83,Pima,15080102,,1069,NAVD88
292,USGS,09537200,"LESLIE CREEK NEAR MCNEAL, AZ.","31°35'24""","109°30'30""",NAD27,Cochise,15080301,79.1,4620,NGVD29
293,USGS,09537500,"WHITEWATER DRAW NEAR DOUGLAS, AZ.","31°21'08""","109°35'04""",NAD27,Cochise,15080301,1023,3909.14,NGVD29
294,USGS,351848111323301,"COPELAND DITCH NEAR FLAGSTAFF, AZ","35°18'48.2""","111°32'32.8""",NAD83,Coconino,15020015,,6708,NAVD88
295,USGS,352025111332401,"GIRLS RANCH DITCH NEAR FLAGSTAFF, AZ","35°20'25.0""","111°33'24.3""",NAD83,Coconino,15020015,,6926,NAVD88
